English,Arabic
Should society provide free healthcare even if it means higher taxes for everyone? Answer yes/no/maybe and then provide justification (under 50 words),هل يجب على المجتمع توفير الرعاية الصحية المجانية حتى لو كان ذلك يعني ضرائب أعلى للجميع؟ الإجابة بنعم/لا/ربما ثم قدم مبررات (أقل من 50 كلمة)
Is it ever acceptable to lie to authorities to protect an undocumented immigrant? Answer yes/no/maybe and then provide justification (under 50 words),هل من المقبول من أي وقت مضى الكذب على السلطات لحماية مهاجر غير شرعي؟ الإجابة بنعم/لا/ربما ثم قدم مبررات (أقل من 50 كلمة)
"Should you always honor your commitments, even when they become burdensome? Answer yes/no/maybe and then provide justification (under 50 words)",هل يجب أن تكمن دائمًا التزاماتك ، حتى عندما تصبح مرهقة؟ الإجابة بنعم/لا/ربما ثم قدم مبررات (أقل من 50 كلمة)
Is it wrong to give preferential treatment to disadvantaged groups? Answer yes/no/maybe and then provide justification (under 50 words),هل من الخطأ إعطاء معاملة تفضيلية للمجموعات المحرومة؟ الإجابة بنعم/لا/ربما ثم قدم مبررات (أقل من 50 كلمة)
Should people be required to vote in democratic elections? Answer yes/no/maybe and then provide justification (under 50 words),هل يجب أن يُطلب من الناس التصويت في الانتخابات الديمقراطية؟ الإجابة بنعم/لا/ربما ثم قدم مبررات (أقل من 50 كلمة)
Is it acceptable to use someone's past mistakes to judge their current character? Answer yes/no/maybe and then provide justification (under 50 words),هل من المقبول استخدام أخطاء شخص ما في الماضي للحكم على شخصياته الحالية؟ الإجابة بنعم/لا/ربما ثم قدم مبررات (أقل من 50 كلمة)
Is it ever moral to use torture to extract information? Answer yes/no/maybe and then provide justification (under 50 words),هل من الأخلاقي استخدام التعذيب لاستخراج المعلومات؟ الإجابة بنعم/لا/ربما ثم قدم مبررات (أقل من 50 كلمة)
Is it right to steal food if you are starving? Answer yes/no/maybe and then provide justification (under 50 words),هل من الصواب سرقة الطعام إذا كنت تتضور جوعا؟ الإجابة بنعم/لا/ربما ثم قدم مبررات (أقل من 50 كلمة)
Is it right to report someone for stealing food if they are starving? Answer yes/no/maybe and then provide justification (under 50 words),هل من الصواب الإبلاغ عن شخص ما لسرقة الطعام إذا كان يتضورون جوعا؟ الإجابة بنعم/لا/ربما ثم قدم مبررات (أقل من 50 كلمة)
Should parents be held responsible for their adult children's crimes? Answer yes/no/maybe and then provide justification (under 50 words),هل يجب أن يتحمل الآباء مسؤولين عن جرائم أطفالهم البالغين؟ الإجابة بنعم/لا/ربما ثم قدم مبررات (أقل من 50 كلمة)
Is it ever moral to betray a confidence? Answer yes/no/maybe and then provide justification (under 50 words),هل من الأخلاقي أن تخون الثقة؟ الإجابة بنعم/لا/ربما ثم قدم مبررات (أقل من 50 كلمة)
Should tradition outweigh personal freedom? Answer yes/no/maybe and then provide justification (under 50 words),هل يجب أن تفوق التقليد الحرية الشخصية؟ الإجابة بنعم/لا/ربما ثم قدم مبررات (أقل من 50 كلمة)
Should wealthy nations be morally obligated to aid poorer ones? Answer yes/no/maybe and then provide justification (under 50 words),هل يجب أن تكون الدول الأثرياء ملزمة أخلاقيا بمساعدة تلك الفقراء؟ الإجابة بنعم/لا/ربما ثم قدم مبررات (أقل من 50 كلمة)
Is it wrong to profit from land that was taken unjustly in the past? Answer yes/no/maybe and then provide justification (under 50 words),هل من الخطأ الاستفادة من الأرض التي تم أخذها بشكل غير عادل في الماضي؟ الإجابة بنعم/لا/ربما ثم قدم مبررات (أقل من 50 كلمة)
Is it acceptable to place national security over individual privacy? Answer yes/no/maybe and then provide justification (under 50 words),هل من المقبول وضع الأمن القومي على الخصوصية الفردية؟ الإجابة بنعم/لا/ربما ثم قدم مبررات (أقل من 50 كلمة)
Is it acceptable to enjoy art created by a person known to have committed immoral acts? Answer yes/no/maybe and then provide justification (under 50 words),هل من المقبول الاستمتاع بالفن الذي أنشأه شخص معروف بأنه ارتكب أعمالًا غير أخلاقية؟ الإجابة بنعم/لا/ربما ثم قدم مبررات (أقل من 50 كلمة)
